<?xml version="1.0" encoding="UTF-8"?>
 <!DOCTYPE tabellaUser SYSTEM "file_dtd_xsd/tabellaUser.dtd">
 
 <!--<tabellaUser  xmlns:xsi="http://www.w3.org/2001/XMLSchema-instance"
       xsi:noNamespaceSchemaLocation="file_dtd_xsd/tabellaUser.xsd">-->
<tabellaUser>
  <user userId="user1">
    <username>Master</username>
    <password>dragon</password>
    <genere>maschio</genere>
    <nazione>Italia</nazione>
    <tipologia>admin</tipologia>
    <sommeSpese>0</sommeSpese>
    <ban>nonAttivo</ban>
  </user>
  
   <user userId="user2">
    <username>Dario</username>
    <password>atomico</password>
    <genere>maschio</genere>
    <nazione>Italia</nazione>
    <tipologia>gestore</tipologia>
    <sommeSpese>0</sommeSpese>
    <ban>nonAttivo</ban>
  </user>
  
   <user userId="user3">
    <username>Thomas</username>
    <password>naku</password>
    <genere>maschio</genere>
    <nazione>Italia</nazione>
    <tipologia>utente</tipologia>
    <sommeSpese>0</sommeSpese>
    <ban>nonAttivo</ban>
  </user>
  
   <user userId="user4">
    <username>Enzo</username>
    <password>vinzz</password>
    <genere>maschio</genere>
    <nazione>Italia</nazione>
    <tipologia>utente</tipologia>
    <sommeSpese>0</sommeSpese>
    <ban>nonAttivo</ban>
  </user>
  
   <user userId="user5">
    <username>Ignazio</username>
    <password>pignuis</password>
    <genere>maschio</genere>
    <nazione>Italia</nazione>
    <tipologia>utente</tipologia>
    <sommeSpese>0</sommeSpese>
    <ban>attivo</ban>
  </user>
  
  </tabellaUser>